{
  "strategy_id": "track_b_ai_90d",
  "period": {
    "start": "2025-12-01T07:55:00+00:00",
    "end": "2026-03-01T07:54:00+00:00"
  },
  "metrics": {
    "net_profit_pct": 0.0,
    "max_drawdown_pct": 0.0,
    "sharpe_ratio": 0.0,
    "profit_factor": Infinity,
    "win_rate": 0.0,
    "trade_count": 0
  },
  "verdict": "hold",
  "observation": "Vectorized backtest with clipped minute-return outlier handling and trade-level win-rate. Strategy contract applied."
}