{
  "strategy_id": "phase1_backtest_real",
  "period": {
    "start": "0",
    "end": "43199"
  },
  "metrics": {
    "net_profit_pct": 1.053084121646768e+19,
    "max_drawdown_pct": 0.1259317910070265,
    "sharpe_ratio": 194.32458901781678,
    "profit_factor": 4.126434066890959,
    "win_rate": 2.048614741244119
  },
  "verdict": "hold",
  "observation": "Initial vectorized baseline; replace signal with strategy contract input."
}