{
  "strategy_id": "phase1_forward_real",
  "period": {
    "start": "0",
    "end": "2879"
  },
  "metrics": {
    "net_profit_pct": 208.76095942439562,
    "max_drawdown_pct": 0.016321120000950685,
    "sharpe_ratio": 335.9239955020949,
    "profit_factor": 6.635509178133022,
    "win_rate": 3.684587813620072
  },
  "verdict": "hold",
  "observation": "Initial vectorized baseline; replace signal with strategy contract input."
}